,cons,pros
1141,"Point system is strict, and takes a year to fall off. Although you can move departments, there really isn't an option to move up. They drill it in that you can move up, and its easy, to move up; That's not true. No room at desks. We sit at long tables with no dividers or space. It can sometimes be loud and hard to make important calls.\r\n  Its trendy, and a lot like high school. Rumors, jocks and cheerleaders. A lot of fraternization, and favoritism by management. Others can be harsh and judge your work..    \r\n   Most management have no idea what they are doing and spend a lot of time chatting, or texting on their phone. If there is an issue, good luck. There are a lot of things that take place that would NEVER happen at another employer. Very young, and mostly inappropriate. \r\n    There are a lot of changes currently happening and big adjustments. I'm hopeful that the immaturity will be addressed and the office can become more professional.","They have great health benefits, and the pay scale just changed and is reasonable, but not livable for anyone with responsibilities. Dress is causal, and they cater lunch daily. There is a stocked kitchen that is impressive, and free for employees. We also get Uber credits monthly which are used to pay for UberEats orders. The location is central, with great views of downtown. Leadership is lax, and not much is taken seriously. There are nearly 50 shifts to choose from, though most are at odd hours, during days, evening, nights and all holidays. Its open 24 hours. \r\n   They are awesome with time off, and allow you to go negative. They also offer parent time which is for school related events like parent teacher or the dreaded recorder concert. They are involved in a lot of community events and things happening around town."
1142,"Poor Leadership with no experience which makes for poor quality of work being produced. Its young, and trendy which results in immaturity and drama.  No space between desks which so speaking on the phone awful. \r\n  They preach upward mobility within, however its more lateral. Education isn't valued here","They are adjusting the pay, free food, perks, great health benefits.  They are generous with time off, and they offer parent time as well which is nice."
1143,"The payment had a delay for some weeks, last 2 weeks was ok. Sometimes is not possible to be trained in time for the needed department .","Great place to work, with an enviroment to help the needy on the platform. Nice structure of resources and kindy people in all of the LOBs."
1144,"- Uber has a bad reputation and is constantly the subject of controversy, protests, and negative press. While Uber is not perfect, I do believe the company has matured since its early years and leadership does take these matters seriously from what I've seen. If you can't handle seeing a negative headline about your employer, Uber may not be for you, but for those that can handle it and want to make a positive impact on our culture and reputation, this shouldn't be an issue.\r\n- Teams and people can shift around frequently as the company continues to grow. This is probably a good thing overall for the company but it can feel jarring at times.\r\n- People work hard–not necessarily because of deadlines but because many of their coworkers are smart, driven, and hard-working people so the bar is set high (that's my experience at least). This is ultimately what you make of it–many people stay late but many people also get into work past 10:00am. Remote work is pretty flexible too which is a plus.","- Uber has hired some of the best people in the industry. I've never worked with more intelligent and driven people.\r\n- Compensation, perks, and benefits were very competitive with companies of similar size.\r\n- The technology stack has matured considerably after some initial growing pains. Engineers can provision infrastructure and build/deploy services without excessive red tape.\r\n- Surprisingly strong, positive cultural values. They are really woven into every day work–used as hashtags, referenced by leadership, etc. Most other companies just create a list of cultural values and forget them."
1145,"The importance of staff at certain times is low, and the knowledge of managers on business and personnel management can be improved.",Resolve customer concerns in the best way.\r\n\r\nPersonal help.\r\n\r\nMedical and transportation benefits.
1146,I dont have anytihing bad to say. \r\nI love this job and i want to make carrer here.,"Have a good enviroment, good partners and good oportunities. \r\nThe place is really beutiful and have this familiar tone tha people love."
1147,"working time its long enough i think should be a way to keep personal stuff in the building, like tooth brush, toothpaste, personal care stuff like a locker.",Best Ambient to work with.
1148,- A misinformed public perception / lack of positive PR can be taxing on employee morale\r\n- Big hours as a result of running lean teams\r\n- Extremely fast paced,"- Challenging and rewarding work, solving problems that haven't been solved before\r\n- Work alongside some of the smartest people in the world\r\n- Encouraged to take big bold bets\r\n- You get to see your idea all the way through and feel like you're having an impact on the business / world"
1149,"Growth in company, Better communication.","Great coworkers. Benefits, pay is decent, and work life balance up to par."
1150,"Communication, last minute updates hours before product launches, lack on timely response from other lines of business","Free food, great benefits, work with cool people that care about the company and the drivers"
1151,Very fast paced and long hours,"Great people, lots of teamwork, and Uber is very much so a values based company who really cares about its employees."
1152,Non-responsiveness from some upper management (pretty much to be expected),"Fantastic benefits, caring management, exciting work"
1153,"Low pay, low mobility, low morale.",It has a lot of money to make big bets.
1154,Long working hours because of lots you can truly own and resolve. Perks are not as good as big companies.,"Really passionate employees who have strong believe in the Uber causes. Fast forwarding futuristic vision held high by executives. Even with really bad media presses in the recent one month or two, the company is still very resilient to the distractions. After a thorough cultural change, Uber is going to be a proud place for the talents to realize their dreams. Everyone can be yourself, without worries about politics."
1155,better training for the new and current employees,"flexibility, great environment, room for growth, constant learning, relax, perks"
1156,"On-going changes, but it's an advantage at the same time! Always learning something new.",The flexibly of schedule is perfect for my current student status.
1157,Schedules. But of course that's almost with every job.,Everyone is very friendly. Its more like a second home than a job.
1158,Toxic Culture is killing the Eng org\r\nNo clear direction,Interesting Problems\r\nGreat Team/People to work with
1159,"Human resources, mobility, employee support, work schedule.","Benefits, physical structure, environment, culture, onboarding."
1160,To be honesty their is no cons for me personally about working for uber. I love everything about this company,Uber is a great company to work for. Friendly Co-workers and everyone is always will to help out each other to make sure everyone has the help they need to do their job.
1161,"The opportunities to move up are very few. They indicate that there is plenty of oppotunities to grow and move up in the company, but it hasn't happened for the 6 months I've been there. The work schedule is never set. It can change in a month, in a few weeks or in a few months. The company doesn't really provide any feedback as to how we are doing. You would think we would get a 6 month review and possible increase in pay...nope that hasn't happened.",Uber takes care of its employees well. There are plenty of nice amenities they provide. You get a lot of discounts from places.
1162,"culture, culture, culture, work-life balance, growth rate","perks, couches, chairs, technology, smart people"
1163,"High stress level, out-of-touch management, poorly developed processes, minimal training, and a false sense of community.","Decent pay, great benefits, supportive peers."
1164,Too much favoritism. And no room for growth. Promises they never keep. They can't handle strong minded employees.,Stay busy. If you love helping people and have massive empathy.
1165,Intense pressure to get all things done immediately leading to high levels of burnout\r\nPerformance reviews could be more transparent,"Energetic, can-do attitude\r\nLow levels of bureaucracy\r\nAbility to clearly see the impact of your work in the environment around you"
1166,Share info a little slower,Awesome place to work with a great culture
1167,There's always people who don't take so much care about the place.,They actually take care of the employees.
1168,"Low pay rate, feedback and training","benefits and environment, culture and values"
1169,All jobs are not like this one,culture team  amazing company
1170,If you don't work in a major city you might not get as much attention as in a major city,Employee Perks\r\nFun Team\r\nSimple chain of command\r\nLots of room for personal initiative
1171,I honestly cant find a Con in my personal experience.,Uber prepares you and gives you the assets to succeed within the company. Theres so much room for growth that it keeps you extremely motivated to try your hardest to expand your knowledge within the Uber brand.
1172,"Politics. Too much of it. Left the company within a year since I could not handle the continuous nepotism, criticism etc of work. We are expected to work like crazy and anyone who does anything other than work is frowned upon. No work life balance. Not worth joining now that the upside is also not much. \n\nRecruiters talk trash of Uber being a $500 B company in the future. I would be surprised if they even sustain their current valuation.",Company is growing fast. Lots of technical challenges. Less of legacy baggage.
1173,"Personally, i cannot complaint about anything.","The company has an awesome and clear mission. Knowing that your work directly impacts mobility of millions of riders and income for millions of drivers is extremely motivating. In addition, working on innovation towards a robotic company is awesome. The environment is perfect for working towards challenging problems and there are no politics. Extremely talented and intelligent people around."
1174,After 3 months - none for now. Not saying that they won't appear. None job is perfect :),Young teams with amazing knowledge\r\nGreat atmosphere with social priveleges\r\nTeam binding every month\r\nTandem which will upgrade your skills\r\nWork which make you happy when solving problems\r\n#beyourself all the time
1175,So far I don't see any,"Work/ life balance, culture & values."
1176,"Only for people who like a challenge and thrive in a rewarding team environment...Not really con, is it ?! :-)","Fast-paced, dynamic, challenging, Fun and Very rewarding environment. \r\nSense of accomplishment and growth.\r\nSuperior Health benefits, Food, Snacks, Rides...\r\nI finally found my perfect environment!"
1177,Lots of work as working in small team,Working with a small but awesome team
1178,Long hours and tight deadlines can get stressful at times. Time management is key to success at Uber. People have the tendency to absorb themselves fully.,Exciting opportunities to grow into various roles. Real end to end exposure. Teams are highly motivated and driven to achieve high results. Passion for the cause is immense.
1179,Difficulties with current problems surrounding Uber.,"Flexibility, room for growth, intelligent colleagues, work/life balance."
1180,It can be intimidating.,"You're working with the brightest minds on the planet benefits, perks and attentiveness to both physical and mental health as overall well-being is unlike anything I've seen. Its absolutely mind-blowing to see your work almost instantaneously changing the world!"
1181,Long hours but in a very nice environment.,"Great working atmosphere, great people and great company culture."
1182,That this was only a temporary position,That is has a excellent work environment along with a wonderful staff.
1183,lot of pressure and cannot have private life,work with very pro people
1184,"the drivers (always having something negative to say) when they are not even working for uber as the company, they are partners... however working for Uber as employees we are always looking for a way to make things better for the drivers",* Flexibitly \r\n* Diversity \r\n* job security and advancement\r\n* work life balance\r\n* pay and benefits
1185,The team that I am part of is very small and there isnt too much room to move up or around. I would have to move to a larger city to see more career potential with Uber.  More a city con than a company one.,The people that I work with are all amazing.  Everyone is always in high spirit and makes the days go by so fast!  Uber is also always changing and expanding and because of that there are always new projects on the go.  Makes for a fun and adaptive environment to work in.
1186,"Lack of communications between departments, Hourly pay is not enough.","Great people to work with, smart and team players. Management also great, growing company and  options to move on within the company, and great benefits"
1187,Management will let u go for no reason with out warning,Great company to work for very friendly environment
1188,"- Apparently, a lack of transparency. I was oblivious to all of the scandals that have been in the news lately, which disturbs me.\r\n- If you don't believe in all the values, you won't fit in. The values are basically not available publicly, and I don't know if they are shared with candidates during recruiting, so make sure you find out what they are.\r\n- It seems like the IPO may be more elusive than at other startups. One starts to wonder if they are putting it off to squeeze more work out of the employees.\r\n- I don't know how common this is, but I was terminated, to the great sadness and detriment of my team, by a higher level manager for seemed like an irrelevant issue.\r\n- Remote work is severely discouraged.","- You get to be part of a historic change in the way people work. Whether that change is for the good will be up to history...\r\n- Some of the engineering challenges are interesting and hard and being tackled by few others. (Lots of other challenges are being tackled by lots of competitors, and I don't know whether they would be better to work for.)\r\n- Guided by a strong mission and set of core values. If you believe in them, you will fit in well and they can keep you going through the long hours."
1189,I think I've only a very personal comment which is about the time it takes to me to get on the COE. Nothing more.,"This is the best place I've ever seen! Uber is fully worried about employees' experience working in it and this is visible not only with direct employees, but with partners (as drivers) too! Love this place!"
1190,"No comments at time, maybe the Human resources to improve more attention in benefits parts","Can be me, I have many opportunities for improve my professional here. So hapy because i was recognized as suberwoman in LATAM. This is a great compensation."
1191,Not being recognized for the work you do and the experience you bring to the table.,Uber is a great place to work. The people are amazing and the environment is challenging.
1192,"The uncultured culture, the extreme lack of structure, the unchecked need to grow too fast, and the lack of guidance","The medical benefits are superb, the exposure to other countries is there, and the opportunity to gain experience is there."
1193,nothing everyones positive and delighting,great pay and a good learning experience
1194,there are none. All is ok.,Friendship. Values. All compensations and benefits.
1195,Nothing at this moment. I am very glad.,-Great enviroment.\r\n-Oportunity to grow.\r\n- A place to develop your persolanity.\r\n-You can be yourself.
1196,Could make more money somewhere else,"flexible schedule, casual work environment, catered lunch, good people to work alongside"
1197,"Some information might be hard to get, values aren't spread too well throughout the company","Friendly environment, nice recognition, a company that cares about their employees"
1198,I haven't found any yet,"Work environment, cafeteria's food, people"
1199,"Nothing at all, i love this job","Its simple, the best job in the world"
1200,Work-life balance might be a little too shifted to the work side,Always hustling and with the support of the most intelligent and amazing people
1201,I still can not find,Is the best job in the world
1202,None really.  Left as I wanted to get out of San Francisco.,"Fun, laid back environment with a good work culture."
1203,Lack of direction in a customer facing environment. Management is not aware on how to manage employees.,It's nice starting with a new company to get in from the ground up
1204,there is not much to say that i do not like so far! i think there should be more gym perks but thats about it!,exposure to lots of knowledge and new ideas . people that work here are very talented and have an amazing drive to success! they are also amazing people to hang out with !
1205,- Leadership needs improvement (at HQ),"- Amazing people: smart, driven, helpful, ambitious\r\n- Impactful work: transforming lives and cities\r\n- Trust in the employee\r\n- Rooting for you to succeed"
1206,"- No 401k (however, you're compensated with equity)","- Work on self driving technology (absolutely interesting stuff)\r\n- Close knit co-working environment (Pittsburgh)\r\n- Get setup with whatever you need (macbooks, standing desks, headphones, etc..)\r\n- Great work-life balance\r\n- Uber credits"
1207,Not a lot of growth in the city I am in. If I want to move upward I would have to relocate and I'd rather not leave my home state for I want to see it grow exponentially and contribute to my community and be close to family and friends. I love where I live and I don't want to give that up at this point.,Open-floor concept in all offices. Makes it feel more like a community than an office space. Hours are great and the pay is enough to get by with. Opportunities are endless but only if you're willing to move.
1208,"Obviously Uber is still a start-up (even though it's a really big one) and it has grown a lot, so many people are very inexperienced (even though they're super smart and hard working) and some things could be better organized, but I am optimistic about the future.","The people are really positive, smart and enthusiastic. I love the collaboration and team spirit. I also love solving real-world problems."
1209,"Poor communication, outsourced but wasn't upfront about it, poor listeners, had 401K setup but did not match, asked for a new manager as mine second one was awful, request denied. It was awful.","Absolutely no pros, unfortunately"
1210,"High pressured environment, that can often be relentless",Great culture and autonomy to grow
1211,"Things move at lightspeed, and as we've seen the last month, it's not always perfect as a result. People come to Uber to kick butt in the best possible way. If that's you, you're in for a treat. But that's necessarily for everyone.","Despite all the events over the last month, I see every day a truly incredible place where every single person can have tremendous impact. Uber holds itself to a high bar, and it certainly isn't perfect. But it's still a great place.\r\n\r\nUber has gotten larger, which just means I can't speak to every place in the company from first-hand knowledge. But from what I've seen with my own eyes in my area, the environment has been remarkably supportive, energizing, and positive.\r\n\r\nI've been at other companies where the environment was actually _systematically_ problematic, so perhaps my spectrum for judging company cultures is different from all the press we're getting. But that is not Uber. There's a remarkably high degree of transparency here, and a remarkably low degree of BS. Uber is under quite a lot of scrutiny, and in part that's a consequence of the company's success. The company has increased in size several-fold, and the culture is still growing up. Again, I can only speak to my own experience, but I've loved Uber from the moment I've joined and every day since, for the problems I work on, for the people I work with, for the trajectory I'm afforded, for the technical areas I have the opportunity to master, for the richness of the data, for the mission of the company, and for the company's earnest desire to always be improving. This place is for real, and the growth is real."
1212,"Many of the best engineers have moved on due to the chaotic work environment and management favoritism toward those creating new things, rather than successfully implementing or running things. Middle management is not supportive in any way. Managers will find and latch onto your flaws, using them as justification to keep you from receiving raises, or promotions. Several teams are traps, existing only to provide their manager with headcount, and struggle to find a purpose. There is next to no coaching, and no training. Teamwork is not valued, only delivering new things. New employees receive terrible credit benefits. The catered meals are a trap. There is a pattern to there not being enough seats at any of the cafeterias, so lunch must be taken at your desk, while dinner isn't served until 8:15pm.","Many very smart, motivated people to work with on big problems; if you're on the right team. A very fast pace of change. Nice, albeit overly-flashy, facilities. The best-run IT department I've ever had the pleasure of working with."
1213,There weren't many cos for me. I really enjoyed working with the company.,The money and hours were great. My coworker were fun
1214,* misconstrued values\r\n* some unilateral thinkers\r\n* performance process,* great people\r\n* great product\r\n* great perks and benefits\r\n* diverse\r\n* dynamic\r\n* high energy\r\n* continuously improving
1215,Always have to be available,"Innovative, little bureaucracy, best idea wins, flexible"
1216,A lot of processes are still unstructured. Ghosts from Uber's startup past still haunts the company's reputation worldwide,Working with Uber an adventure - you do different things and meet different people on a daily basis. Cross-functional and cross-regional work are facilitated by transparent discussions and collaborative team members. Be part of the online revolution.
1217,"- POLITICS (even if you try to avoid them you are negatively impacted)\n- Bad hires: In the beginning I think Uber hired a lot of great talent and good people but now it is growing so fast that they are not hiring well, and they are hiring a ton of jerks that do not care about the people or culture and make people feel like you should just be lucky to work at Uber. It's sad - a lot of good talented people are being treated poorly and no one seems to care.\n- No work life balance: expect to work all day, everyday and weekends and to feel like you are still not doing enough\n- No real recognition: Even if you work 24/7 and are good at what you do expect to be told you aren't doing enough and to wonder why you aren't being taken care of financially. This is leading to burn out and vets of the company leaving\n- Trust: Everyone is out to protect themselves and will throw you under the bus to look good really quickly, no one trusts anyone anymore","When I first started at Uber I was really excited and knew that there would be a ton of opportunity for growth professionally, and I knew it would be a challenge but I was ready to work hard. When I started in 2014 you could feel the energy and excitement, which has mostly gone away at this point. There are still a ton of great employees there and I made great connections. Free food and Uber credits are nice and they do have a good benefits package."
1218,"At Uber it is a fast-changing environment, work-life balance.","Excellent work culture, access to technology and resources, young and enthusiastic team with go-getter attitudes, fast-changing environment, ability to chart your own path and implement ideas"
1219,I don't have negative feedback for now.,I'm really happy how high skill level of engineering we have in our local office as well as in HQ. Also everyone in the team is very friendly and I would say that we have quite healthy atmosphere in the company overall.
1220,Uber is not for people who like things easy.,I feel like I'm taken care of at Uber. It's a job for passionate people who want to make an impact.
1221,I dont have any thing to say here soo far,"i got a leasing specialist position with uber like 3 months ago and i think i made my best decision so far , it is an impecable company to work for , nice manager nice co workers, they treat there people soo good"
1222,Intense!  The super day is back to back and they certainly test you,Very transparent about the role and the challenges people face.  Efficient and timely interview process. Everyone is honest and willing to give your their opinion.
1223,Pay could be increased more,Loved it for the while
1224,- Salary under market given the quality of the team\r\n- Work hard without paid extra hour,- Fast learning curve\r\n- Freedom to develop projects and skills\r\n- New challenges everyday\r\n- Perks
1225,None so far. maybe a little the stress handling.,"Great exposure, and very dynamic company."
