,cons,pros
0,- Business stagnation in India and overseas\r\n- Bureaucracy,Low gender wage gap in entry-level and mid-management roles
1,There is no structure defined for work. One has to figure out by themselves.,Flat hierarchy. Benefits are good. Food in the office is very good. Growing organization.
2,Good to join as fresher,Nice experience easily accessible and easily learning
3,As of now nothing as i haven't noticed anything yet.,"Unmatched employee benefits,Good working ambeince, Good facilities."
4,1. Too much work for an individual,1. Superb culture \r\n2. Loads of problems to solve for \r\n3. Fast moving \r\n4. Transparent organisation
5,No negative words about this company,It's a good company to grow my career ...
6,Net earning reduces to 12 / month,"Early it gives good business but slowly slowly it cut all benefits like boost ,surge and incentives per trips. So, working forcefully to pay my  pending cars EMI"
7,"No learning, Biased managers, No Meritocracy, Disgraceful Integrity of leadership. All gyaan and no action by management","Compensation, Benefits, Flexibility. Nothing else to add"
8,They could have a more comprehensive training process for lateral hires.,Uber has an inclusive culture with great learning opportunities. \r\nPeople here are very supportive to the new joinees. \r\nIdeas are really valued over hierarchy. \r\nManagement is not shy to answer bold questions put by employees.
9,You can expect sudden work calls which can be hectic at times.,"The Work Environment is really Nice, No formal clothing and all, you can even go to office in a jeans and a tee, all employees are provided with MACBOOK and Iphone to work"
10,"Work is not that top of the line, most of the exciting work (at least for engineering)  happens out of India\r\n\r\nThe Engineering leadership is blindsided, the cultural values is just there to facilitate big posters with motivational slogans. On the ground there is ample politics you need to deal with before you can start getting stuff done.",The benefits are awesome and the kind of opportunities available are one of the best in all over India
11,Being a remote location does have an impact in ability to contribute.,Great salary and benefits. Decent work life balance. Get a chance to do things at scale
12,Its a 3rd party pay roll,Work environment is very good
13,"1. Even though the work is good, ownership of core components lacks , but i think thats changing slowly with addition of new charters at the site","1. HR Hiring and Interview Processes are very streamlined\r\n2. Interviews have clear expectations set, i.e. if its for coding or Problem Solving etc. so candidate can focus more on whats being evaluated.\r\n3. Awesome Managers who make sure you get enough exposure and opportunities at the same time take care that you are not stressed with late night meeting/onCall etc.\r\n4. Great Documentation, that helps engineers get bootstrapped on Uber's Infra very quickly.\r\n5. Everything else like Pool, TT, Free Food is there for people who care about it."
14,"A really great organisation to work for. But the few things that can be avoided are;\n\nOver staffing,\nOver spending,\nWasteful expenditures",Let's your creativity flow\nChilled out work atmosphere\nExcellent amenities and perks
15,Growth constraint in terms of promotion,Good  learning experience from seniors and managers
16,Less salary hikes no recognition for hard work,Good office and nice food managers are very friendly and good work life balance
17,"Should also have stringent HR guidelines when lot of liberty given to resources, there is a possibility of misuse at Uber policies, people try to play around so need to mitigate the same HR guidelines to be little stringent.",Employee liberty and Employee centric organisation with lot of benefits to staff which is good but there was no control over it hence misuse may happen.
18,Heavy Politics at the workplace,Strong work culture and ownership
19,less salary hikes and they need to intract with the employess to have better work life balance.,work environment is good but should bare with politics in the office
20,"At times, work can get real stressful, due to the pace at which the company moves.\r\nWork-Life balance can take a hit at times due to this.","Great place to work\r\nGreat Employee benefits - Free Food, Great working environment, Employee Wellness Benefits, Pick &amp; Drop Cab etc etc\r\nGreat Peer group - You get a chance to work with some really bright people\r\nAbsolute Transparency - Atleast in the division that I work, there are clear cut processes in place,  great visibility for the work we do.\r\nIf you are good, you will shine &amp; no one can stop you, similarly, if you are not so good,  you wont have a place to hide either."
21,"Transport facility is not available.\nWork from home can be taken only during emergency. \nPayroll Manager is not clear with what has to be communicated and command over the language is not good. \nManager trust only 2 or 3 employees and wants all other team members to work as these 2 or 3 members say. If you are individual performer who wants to handle & process in your way, then it's the worst place. If you want someone to check and keep asking everything what you work on, then it is the place your are looking for. \nManager rushes for all the activities, there is not defined timeline. Everything has to be actioned and replied in a day or within 1 or 2 hour.  Basically manager doesn't know how to prioritize work.",Good salary package \nAdditional benefits
22,No work life balance\r\nNo job security\r\nBrutal corporate culture,Cool office \r\nFlexible timings\r\nGreat Technology
23,There's nothing bad about Uber.,"Values, Culture, Ethics, Friendly, No dress Code"
24,Learning is little slow in the beginning.,"Good Work culture, Good Food. awesome team. Great opportunities."
25,Not very interesting work\r\nOffice location in outskirts,Good Pay\r\nGood work life balance
26,"growing pains with organisation, will be ironed out in time","Excellent team, impactful work, good long term potential"
27,"I am not very clear about my career path here. \r\nNeed some help from seniors, and mentors.",Highly professional space. \r\nFriendly environment. \r\nInspiring colleagues. \r\nChallenging tasks.
28,- Disparity in salaries\r\n- Dynamic org\r\n- Always changing HR policies\r\n- Industry 'experts' from traditional Indian companies inducing bureaucracy,- Great learning\r\n- Amazing perks\r\n- Chilled out environment\r\n- Superb workplace\r\n- Best internal mobility policy\r\n- Challenging work
29,- The first few months will be hard to adjust to such a fast paced environment\r\n- Might face stress due to overload of work during select weeks,- Work satisfaction is great as a lot of responsibilities and decision making is given to the employee\r\n- Employee benefits is excellent and stands out compared to other similar companies
30,Not structured organisation keep on updating process,Perks and pay growth is considerable
31,Rational shifts are not so healthy.,Growth opportunities are wonderful here.
32,"Lacks Management but will be fine after few years. They just started, Learning and development is a part of the process.",A new Company so the learning and growth is immense.
33,"As a new company, there's much to be streamlined internally in uber","All other companies say that they value their employees but dont stand on it, on the other hand uber really cares for their employees and make them feel like you can achieve your goals."
34,Managers need to pay a little more time for their reportees and their problems.\r\n\r\nLocation is literally outside bangalore,Excellent work environment\r\nBenefits are excellent.\r\nWork life balance is excellent \r\nManagement is understanding about Flexible working hours because of bangalore traffic
35,stagnant growth and fixed working hours,Good culture and free food
36,It will be too early to comment.,Good culture and lot of scope to improve.
37,Nothing i can think of.,Good company culture. You'll make good contacts and get a chance to interact with management often.
38,You have to be very quick in learning to grow,Its the best place to work in Hyderabad
39,Time is good . It's flelible,Good company . Happy to work
40,No salary and learning growth.,Great working environment and get appreciation and reward for the same.
41,"People are just doing work as headless chickens, always fighting against short term strategy vs long term strategy\r\n\r\nWide disparity in pay in the same level and same org","Relaxed work environment, its just going on auto pilot- so lot of work life balance"
42,- Initial few days can be overwhelming because of all the responsibilities handed over to you,- Amazing opportunity to learn about data analytics and team management\r\n- Full ownership of responsibilities is given to individuals
43,- Over time the org has become slow and less innovative\r\n- Quality of hiring has gone down over the last 6-12 months,- Great culture\r\n- Interesting and challenging problems to solve on a daily basis\r\n- Company vision is something all employees buy into
44,- Demanding\r\n- Too much work sometime,- Flexible\r\n- ownership experiance\r\n- Culture is good
45,Work delivery can get ambiguous,Great Learning Curve\r\nVery Global outlook\r\nGreat Workplace
46,Simultaneous many things happening across globe,Strong ownership given for your role\r\nYoung and super-energetic employees\r\nStrongly connected to all stakeholders
47,Work life balance can suffer if one is not able to manage time,1. Challenging work environment\r\n2. Extremely smart colleagues to learn from\r\n3. One can see the result of initiatives immediately on the ground
48,"Absolutely no work life balance,  no time to connect with team members, various medium of communication resulting in more confusion and delay, hell lot of meetings on a daily,weekly &amp; monthly basis, very fast paced work life and aggressive approach, Uber employees expect overnight change/development, employees are paid way less if compared.","Spacious work place, free food and transport, good use of technology"
49,"Slow growth, however, if you have skills you will definitely be valued","Employee benefits,  cool environment to work and nice team spirit."
50,Handling too many people at once.,1. Friendly and helpful people around.\r\n2. Amazing environment \r\n3. Hardworking talented team around.\r\n4. Breakfast and lunch
51,Politics within greenlight centres and,"Lot to learn, Great collegues, employee meals."
52,1. Nothing as of now.,1. Challenging Work\r\n2. Good Facilities\r\n3. Awesome Mentors from renowned companies\r\n4. Employee Friendly
53,"but cannot enter in to on role ,no appreciation or team outings",free food and flexible time
54,Nothing much. It is a pretty good place to work.,It is one of the good places where you can learn and improve your skills and provides a platform to present your thoughts
55,nothing i can think of,work life balance is very good
56,No cons as far as I remember,Free food\r\nAwesome work environment\r\nNice management
57,"Lot of work, 10 times more than the package they provide.","Free Food, Free transport, Good package if your fresher."
58,Only thing is we cannot meet HR Face to Face all through Emails.,"Well Organized , Supporting Managers &amp; Team Mates."
59,It doesn't give you support and does not care for it's customers.,It gives you good offer.
60,We are still finding our feet in terms of our work Culture. It's not the same what it used to be when it comes to speed of execution (to a large extent in a good way) but still 'agility' is our key strength and we can't let go of it.,Are you searching for a meaningful career?\r\nJoin if you want to do something meaningful in life! Truly a place where what you do has an impact on your community in a direct way.  You're given the space to do things your own way and take risks and help the company move forward.
61,Non so far. Hope there won't be in the future as well.,*Great work environment.\r\n*Freedom to manage your work.\r\n*Flexibility \r\n*Respect from the leaders.\r\n*Transparency
62,Less opportunities to grow with the firm,Great place to work with
63,long hrs\r\northodox policies of the hr,Good Work environment\r\ngood salary gives
64,Slow growth.\r\nSudden process changes.\r\nMonotonous work.,"Exciting work pace.\r\nChallenging work. Semi technical, skills like SQL are added advantage.\r\nGood pay.\r\nFree food, 2 way cab + perks like 3k credits for cabs, insurance worth 7.5L.\r\nManagement cares for you!"
65,none that I could find,"Purely tech-enabled company\r\n- Brilliant co-workers\r\n- Well structured process\r\n- Great learning and growth opportunities\r\n- Great perks\r\n- Coolest office\r\nI literally never got a negative vibe while working in the office, all colleagues are highly energetic and understanding."
66,- none that I could find,"- Purely tech-enabled company\r\n- Brilliant co-workers\r\n- Well structured process\r\n- Great learning and growth opportunities\r\n- Great perks\r\n- Coolest office\r\n\r\nI literally never got a negative vibe while working in the office, all colleagues are highly energetic and understanding."
67,"Heavy workload at times, not always though","The best work environment, free food and snacks :p, free cabs and Uber Credits ❤️"
68,Silo culture and Surprise organizational decision which suffocates the employee on his job security.,"Freedom of work, Young and energetic team, opportunity to explore the innovative thoughts and ideas, Good Human Resource management, facilities to employees and good work life balance."
69,Lot of politics\r\nManagement favours wrong people\r\nGrowth is slow,"Good team, Perks are cool, Office is spacious, Engineering team is fantastic"
70,the strategies used by company are based on the work done by other companies they are not at all applying their brains.,"Work timing flexibility, no need to go to office is u r in sales. just go directly for meetings. nice incentives.  Nice office and supportive peers."
71,salary and promotion. incentive term period is not proper,great experience to work on global platform
72,no cons yet to my notice,Good Team and Helpfull supportive Managers
73,"nothing as of now, everything is fine",supportive central team with motivation
74,"No week off, lot of politics.","No work pressure,free food and cab"
75,Formal work environment\r\nEmployees to worried to let their guard down,Good pay\r\nMany perks\r\nSystematic approach\r\nRespect for time
76,- Sometime work is too much,- High Impact Job\r\n- Lot of Autonomy\r\n- Great Brand Value\r\n- Perks are pretty good\r\n- Very Smart/High Quality People\r\n- Strong Global Connect
77,The con would be that since its startup the process and everything else is very unstable and highly volatile also there working patern and style and are defined and very messy all over.,"This company has Great Environment and Good opportunities, Something additionally good about this place is  Salary and the Benefits they provide and the fresh culture they have."
78,For Field work.   Nice.           .......,Good payment timing   good teamwork
79,Nothing much negative about Uber.,Best place to work and best place to learn.
80,"As of now I have 0 cons with the company, wish it remains the same as I love working in here.",The work environment is awesome. We do have flexibility as in the working hours and shifts.
81,"It is still in a startup mode, if you are looking for MNC culture not the place","Lots to learn, great pay, awesome office"
82,There are none for this organisation.,BEST people to work with
83,Not Applicable/ No major cons found,Very good ambience and working culture\r\nGood managers and Colleagues\r\nGood facilities like Credits and Goodies
84,"No promotions  as fast , growth is sometimes in challange and some juniors could be lost in beginning ..",Organising social parties well and no compromise in cost at all..
85,-Bleak chances of promotion\r\n-Be ready to work yourself off!,-Amazing work environment\r\n-Always hustling\r\n-Great platform for learning and growing\r\n-Family away from the family
86,Work life balance is not that good.\r\nAlways sprinting.,Freedom to work on new things and explore unknown territories\r\nGreat learning opportunities.\r\nSmart team and management.
87,"1. Micromanaging, which sometimes feels very suffocating\r\n2. Too frequent change in working policies","My association with Uber has been great, they has an open and great working culture, open to new ideas and make the employee feel comfortable. The environment is competitive and challenging and lot of hustling goes around each day."
88,Lack of proper HR structure. Extremely flat teams in a large set up leads to chaos and lack of proper career path for the employees.,Exciting and fast paced work. Lots of challenging problems to solve.
89,Pay scale although other benefits should cover it. Slower than Indian competitor but takes a higher commitment to quality.,"Aggressive Work Culture, Encouragement for growth, Room for experimentation, Company investing back in you"
90,"Rotational shifts and offs, with not enough leave days",Really fast growth if you are willing to go the extra mile
91,"tiresome work, high expectations from leadership, tools yet to be modified, transparency is feeble, less motivation by managers and very little interaction with the leadership team","Work culture, food, transport, co - workers, management, perks, work place, fun at work, strong team leads and managers, values and obsession for betterment"
92,Not much growth and pay could be more,Lots of benefits and perks
93,Nothing bad to mention about.,Amazing perks.\r\nLove the work environment.\r\nCrazy food.\r\nLovely colleagues.
94,"Everything is streamlined, Nothing to say more.","Good place to work, nice environment and culture, Team support"
95,Culture should be stringently followed,Lot of opportunities to explore\r\nLearning new things related to the projects & management
96,A bit downside on work life balance but its currently being worked on,"Extremely talented peers, can learn a lot"
97,Micromanagement. Pressure. Not great colleagues.,Great management. Freshers get an amazing exposure. Good food and ambiance.
98,Management\r\nHierarchy\r\nNon transparent  \r\nHeavy Politics\r\nOrganization Run by single Person,Perks\r\nFriendly Workplace\r\nGreat Colleagues \r\nEasy Commute\r\nTable Tennis
99,1) Work can get really hectic at times.,1) Everyone is treated in the same way in the office.\r\n2) Work and free time are managed in a very nice way.\r\n3) Everyone is very approachable.
100,None as of now. Minor problems are always addressed immediately.,"Freedom to work, good food at cafeteria and friendly management"
101,- Huge growth in headcount: High growth led to confusion on ideal growth trajectories\r\n- Competitive Culture: Appraisals and promotions were fairly cut throat and visible to weed out star performers and put pressure on other employees\r\n- Autonomy: Initial autonomy over time reduced as more central and management oversight layers were added,"- Exciting Products: Some of the most exciting problems to work on in one if the most exciting markets\r\n- Smart employees: Many over achievers, is a great learning environment\r\n- Take care of employees: On the whole they do take care of their employees, financially and in other respects\r\n- Mobility: Fairly easy to move to other geographies or other teams"
102,Super quick decision making leads to anxiety before results,"Close to Business, \r\nChallenging problems and freedom to solve them.\r\nGreat team.\r\nTruly global product and brand."
103,Rotational shifts will take a toll on your body and your daily regimen. This might hamper your productivity if you're working just because it is your organisation business requirement.,Work culture\nPeer group\nWork-life balance can be possible only if you know how and when to work\nPerks
104,work life balance is not the best,Superpumped and lots of valuable work
105,a bit slow in hiring,a great exposure to start up world
106,"Office politics is too much\r\nnon cooperative collegues , very selfish sometimes\r\nWorking hours is pathetic\r\nlow wages",1.Great Place to learn\r\n2.Helpful seniors
107,"As the company is settling down, the growth opportunities as a individual is slowing up.","Amazing place to work! Company has grown ten folds and is still growing. If you believe that you are the part of the system then you'll definitely grow here, coz UBER is one hell of a startup. \r\n\r\nSalary - for freshers is amazing."
108,Nothing such only that you need to have a sense of driver empathy.,Hustle is what drives UBER.
109,"- None as such. If there is some issue, top management is very keen to hear and solve it.",- Top notch work quality\r\n- Extremely smart colleagues\r\n- Very good salary\r\n- Awesome incentives & perks\r\n- Great growth potential\r\n- Travel to San Francisco for training
110,Has not spend much time in India. Have also to concentrate in the smaller cities for business growth.,It is a professional organisation. Doing the business well in India. There is ample growth opportunity.
111,A lot of experimentation is done constantly\r\nOnce a startup now becoming more corporate,Work culture\r\ndelicious food :D\r\nFree uber rides!
112,working environment and not  a technical job,nice working at uber and freindly enironment
113,"kids with spreadsheet, making un-wise decissions",Excellent opportunity to share best practices
114,Improvement in everything is required from time to time . So I'd like to say everything can be improved slowly to make the company newer day by day.,Such a friendly company which doesn't force and disappoint its employees. Many opportunities to grow. Awesome please to get into
115,Too fast for the people who are too slow.,Yesterday is History and Tomorrow is the vision. That is what Uber is about. Always Hustlin' to find a way to become better with lot of empowerment to employees.
116,As of now there is no such thing which i felt is not good or lacking here :) :),Uber is really a awesome place to work with the environment that culture and mainly the FREEDOM TO WORK ACCORDING  TO OUR CONVENIENCE.\r\nAll the employees here are super friendly and there is no differentiation between leads and COS that the most coolest  thing.
117,"1. if you are used to a very structured and predictable workplace, then this may not be for you\r\n2. you have to be a total self-starter and self-completer too (everyone is as overworked as you!)","I came to Uber with 6yrs of sellside equities experience, and I was very apprehensive at first. But my apprehensions were misplaced for the following reasons:\r\n1. Super flexibility...everyone is allowed to work at the pace, style, method they chose to. Your deliverable is water-tight...but how you get there is your call.\r\n2. Data-intense .... all decisions, meetings etc are backed by data, which means that no one uses their seniority to bulldoze their ideas through. Also meetings are super-productive, I dont think in 3months I have done any pointless or inconsequential discussions\r\n3. very aggressive, fast growing and fast moving place.....which means there is no room for pointless hierarchy...if you have a great idea, go ahead discuss , execute and own it."
118,- Work Life balance\r\n- Prioritisation,- Autonomy\r\n- Quality of Peers\r\n- Mobility within the org\r\n- Speed of execution
119,The company is still in its adolescent stage ( which is more than often a good thing).,"Amazing work culture, Convenient shift timings, Night shift allowances, Free meals, snacks, free transport, Additional free rides, brilliant managers!"
120,"Slowly moving away from start-up culture, so in some areas things getting delayed\r\nAttitude issues at the lower level management which is not seen in top management\r\nsome people do not fit to the culture cause hindrance to processes","Empowerment in decision making, accountability for each actions, great team to work with \r\nSuper cool managers, work-life balance\r\nDynamic work culture"
121,"Direct exposure with partners, employees must know how to deal with them.",1. Amazing workplace\r\n2. Encouraging heads\r\n3. Liberty to contribute to strategies and plans\r\n4. Innovative ideas are welcomed\r\n5. Great teams to work\r\n6. Flexible timings
122,"- Not much induction, you are Sea literally in first few weeks\r\n- Older Uber folks generally don't think person need time to adjust and things come at you very fast",- Super fast ride in one of the finest company of its era\r\n- Very smart people who are really passionate about things they are doing\r\n- Lot of autonomy to local teams/regions- Not typical HQ driven company\r\n- Amazing onboarding program called Uberversity where all nubers from Globe come and participate at HQ (SFO)
123,Coordinating with driver's maintaining fleet's,I worked with ola cabs for 2 years in operations coordinator
124,More of driver centric profile \r\nWill hire through 3rd party and it's difficult to come on uber payroll as when and then there's a opening they will hire people from outside mostly \r\nLess pay,Got to learn lot of non technical and management skills being working at transactional level
125,Change word anytime.to handle the process in Mumbai management is not good pls change the management team.and give more space to Uber dost to handle the process,Prossess is good and give us to even money but need to more improvement in apps
126,Pros are at the higher side so I have not found any Cons till date. Hope I will not come across any.,From the day I have joined I have a great feeling that I have got an excellent platform to exhibit my abilities and grow as fast as I can. #Super-pumped #Enthusiastic
