,cons,pros
621,"When being a small part of a big machine, some of the work can be relatively tedious\r\nThe learning curve is really steep in a company with so many services and so much history\r\nThere's quite a bit of complaining over trivialities\r\nLack of effective ability to debug code due to high number of systems\r\nSome people focus on vesting and then moving on\r\nPublic perception, even within the Silicon Valley tech community","Intentional, planned, positive culture\r\nThe people on my team have been really inclusive\r\nPeople are really proactive and helpful\r\nPay is really good\r\nEquity is really good\r\nLots of opportunities to get involved in interesting and important projects outside basic in-team project work\r\nThere's a big focus on contributing back to society\r\nBreakfast, lunch, dinner and an amazing variety of snacks are provided, as are heaps of drinks, including beer in the evening\r\nDara's leadership is great\r\n\"
622,Challenging and a lot information will come to you everyday,New platform for the world and opportunity for everyone
623,"- The management was kind of full of themselves \r\n- They claim to be very open minded but heard two managers talk condescendingly about some of their employees. But I can't say that this is a reflection on the entire company, maybe it was just those two.",- Great extras such as free food\r\n- Great people\r\n- Nice culture &amp; office
624,- Excess information can be overwhelm,- Inclusive and welcoming environment for women and LGBTQ+ people\r\n- Company is growing very fast and you have possibility to grow too
625,"Due to the need of high-qualified workers, we can notice the lack of diversity within some teams.","Most of the employees have autonomy, capacity and are very committed to work."
626,Still under construction so thinks change a lot,be part of a revolucionary company that is changing how people and things move from one point to another\r\ncompany that is worry about their employees and work evry they to make it a better place to work
627,- Overwhelming at first\r\n- Low bandwidth for teams,- A chance to work for an impactful company that produces mass changes in our cities and economy\r\n- Connect with multiple talented people from around the world \r\n- Work on challenging projects
628,"In order to take best advantage of all the opportunities company has to offer, you should dedicate yourself and put your best game on.","Even after being here for almost 1 year and half, I keep been exposed to new and challenging experiences - I believe I had never learned so much in such short time. I super recommend this position in Uber for those who are willing to take their career to the next level and give your best."
629,"There is competition. But I don't see it as a con, once you're pushed to give your best.","There's no other place where you have collaborative work. People like to get together in order to solve problems, help one another with the projects.\r\nIt's a place where you can grow up professionally involving yourself in a lot of different projects.\r\nA company focused on the future of cities."
630,"Sometimes people here expects too much from everyone, so the work/life balance needs some attention.","Uber gives a lot opportunities for growing professionally and inside the company, and working for a market like Brazil makes it even better, as we have a lot of challenges in the country and the company will help us to overcome it."
631,"We need some work on process, but we are working on it.","It is a great place to get your career started! We are still considered a start-up company and with that, comes the opportunity to make a difference. All the managers truly care about career development and there is overall a sense of family within the tech recruiting org. We are all treated like adults here and managers don't care about the little things like what time you get in the office etc. as long as you get your work done.  Amazing company to work for!"
632,"Difference between full timers\r\nOthers had gym benefits, some didn't",Credits for transport\r\nExcellent medical benefits
633,"Reputation, unfortunately the company/team has gone thru some bad period, hopefully we are over that.","Leadership, Dara has a clear goal of how to drive the company \r\nProjects still very challenging and interesting regardless on the area you may be. \r\nTeam, direct leaders, the experience I've had is great, the team and leaders let you do the best you can."
634,Can't think of any right now,Autonomy\r\nGreat Leadership\r\nAbundant opportunities for personal growth
635,Nothing to say about cons.,We help people to move forward and we do the right thing. Period.
636,Lots of simultaneous demands and projects,Full autonomy to work and flexibility
637,"-Depends on your preference and mindset, but incredibly fast-pace work rhythm can be overwhelming",- Amazing Culture\r\n- Open doors to learn as much as you want\r\n- Career opportunities and personal growth focus
638,There isn't any down side it's a great company,Everything there is great and they are fair
639,"Low salaries, very low year-end bonuses","The mission of the company, good corporate culture, growing company, a lot of traveling"
640,"structuring of processes, with focusing on the areas of support.","People, opportunities, we do the right thing, work environment, career."
641,"Company had limited cash at times, but that's what you'd expect as a growing startup.",I don't understand what everyone is talking about in the press. I've really enjoyed my experience at Uber as a Product Manager and had the opportunity to work face to face with Travis often. He was a true visionary and inspired those around him with a calm demeanor and fair management.
642,"- Sink or swim (more of a pro imo, but depends who you are)","- Amazing culture, driven individuals will thrive here\r\n- Autonomy is the default, support is available\r\n- Emphasis on personal development\r\n- Big things ahead"
643,There's a lot of Uber drivers out there which creates competition. Wait time in between fares.,Over the past year I've had the pleasure of meeting wonderful people through the job. I learned to adapt to different moods and behaviors from customers. I learn a great deal by listening to clients and what they have to say.
644,"Uber is still trying to establish a new culture by incorporating what made the old Uber successful while making the changes needed to become a world class tech company. This new culture hasn’t quite taken hold yet, but the majority of the company is getting behind it.",* Lots of smart people to learn from and opportunities solve difficult problems. The initial learning curve is steep but resulted in intense knowledge gain. First class tech stack to work in with powerful tools to help you be productive.\r\n* Freedom to work on projects you find interesting if you can prove it will be impactful. Relatively little red tape in starting a project once you have validated that it will be useful and provide value to fellow engineers or users.\r\n* Much improved work life balance from what I hear it was like in 2015 and 2016. You’re measured on impact more than time spent in the office. This is true with time off and working remotely as well.\r\n* People here are genuinely interested in developing a positive and inclusive culture and learning from the mistakes of past.
645,"I am working at UBER since 2015 as ext employee and now iam  FTEs employee , But really hope that the salary will be alittle bit more as the reposnability i have .","I love this company , It's my life carrer ."
646,- Fast-paced environment\r\n- Unexpected decisions,- Growth/Career Path &amp; Opportunites\r\n- Autonomy\r\n- Benefits\r\n- Work Environment\r\n- Good Management\r\n- Upholds Cultural Norms
647,The job task can change multiple times in one day,Freedom to grow with the company\r\nCatered lunches \r\nFriendly environment\r\nUber credits for rides or Uber eats
648,-Constant changes require fast adaptation,"It has been a very good experience, with lots of opportunities to learn in a very fast paced growing company. \r\n-Great office and people attitude\r\n-High-performance team"
649,"fast paced environment, you need to adapt to change constantly.",Awesome company and great people taking their job seriously.
650,"Some process are not defined, as any start up, however they are working on it.\r\nCareer path and job levels doesn't exist, super flat organization.","Cultural values are very important, huge opportunity to grow and develop new things, ideas and projects"
651,Nothing. I'm very happy with them.,Customer centric. I love it
652,"Poor leadership. Leadership and overall management didn't exist. Most are young employees doing very little and everything is over looked. \r\n   Employees handling the most sensitive issues (sexual assault, physical assault, fatalities) come into work dirty, talk about how much weed they smoke and how much they drink nightly. \r\n  If you are an uneducated, unprofessional person with poor hygiene, you'll fit in.\r\n\r\n It's similar to high school.\r\n\r\nMajor things change on a daily basis. Like schedules, policies and procedures with little to no notice.\r\n\r\nEveryone tries very hard to be important. Always coming up with some \","Uber credits monthly, stocked kitchen free to enjoy, and a laid back work environment. Good health benefits."
653,Management is skewed. Not much room for advancement. To get anything done its going to take weeks before you get answers.,Insurance is great. PTO and sick time are available.
654,A lot of PR scandals affecting the environment of the company,Being in Uber has been the most impressive learning opportunity of my career. You work with the rally talented people all the time and you have the empowerment to lead your own projects across different markets and take your own decisions
655,"Work life balance it's difficult, as you are in fast growing company.","* Uber has the best of both world, a startup agile approach with a corporate focus on employee satisfaction.\r\n*Great amenities, perks and benefits.\r\n*You are alway challenged to improve"
656,Fast-growing. This sometimes can be challenging for consistency.,"Multi-cultural environment, Challenging atmosphere. A place where you are able to contribute, own impactful projects and share your ideas."
657,- Continuous org changes  (but can be consider as a Pros)\r\n- Sometime you have to work really hard (overwhelming and stressful),"- Your actions and decisions have a lot of impact in the people and cities - you are shaping the future\r\n- The culture is awesome: great perks, people, offices, etc\r\n- Autonomy and freedom to work on projects\r\n- Lots of opportunities to solve difficult problems and grow"
658,"Since we are moving at such a fast pace, role lines are blurry. Most people here were hired to do one thing and are actually doing something  different.","Uber is a diverse, costumer obsessed company. We don't work, we hustle. The fast-paced environment makes everyday exciting."
659,"Work-life balance can be hard to achieve, due to the high competitiveness it might be difficult to advance in your career.","Highly competitive, groundbreaking and meaningful work, you get to work along with the smartest people ever and you get to see how your work impacts cities directly. Open and free kitchen with above average benefits."
660,"Can be a rough start, it is a big company that grew very fast. Some team processes are still designed for smaller teams, while at the same there is a lack of communication between some areas . This makes it a bit tough to navigate at first, though a) you get there and b) there are efforts from leadership to update structure and roles to avoid this problem.","Great benefits and in-office perks. Very knowledgeable and smart team, even at the lower levels there is people with significant experience and a ton of drive. The company vision is also very easy to buy into, it really feels like we are shaping the future in a big way. Specifically in marketing, Uber provides the resources and demand that you need to actually send trends and innovate within the industry."
661,The company is not very popular in SF.,Uber has the most positive working environment I've ever seen. Engineering coworkers are often more talented than colleagues in academia. The work is challenging and impactful.
662,No annual performance bonused. No work-life balance,A lot of food for free. Good mentorship
663,Not a full time employee\r\nNo Uber credit,Great company with lots of opportunity to grow.\r\nFast pace working environment.\r\nTechnology company that is setting the bar for future.
664,Need to have Bonus,People here are always trying to make you feel comfortable with our environment and providing us the tools we need to be successful
665,"The company grew up so fast that a lot of things were done without planning or without taking into consideration how that grow could impact the structure or employees.  In the Bay Area we have more than 5 offices, so employees need to be moving between this offices and it's a waste of time.\r\nI have met employees who really like the \","The culture is very different from where it was last year, now it's much more positive.  \r\nOur CEO is very smart, humble and human.\r\nIt's great to work in a company that is shaping the future.\r\nAll the employees I have met are very professional and willing to do the right thing.\r\nYou can definitely feel how the company is changing from a \"
666,"The public and media perception of the company is disappointing but to be expected. I've seen nothing but positive signs since joining and fully 100% stand behind the senior management, and the strength of our new culture. You can tell management has taken on the task of fixing Uber's past problems very seriously.","Great compensation package and some of the best benefits in NYC tech. Smart people with a shared vision. Strong cultural values (yes, really!). Excellent work/life balance. Bureaucracy is nowhere to be seen."
667,- Leadership communication\n- High senior leadership turn over\n- Some leadership can be deceitful or say they’ll do something for you and won’t,- Free catered meals\n- Free snacks and drinks\n- Great health benefits\n- $300 in credits a month\n- No micro-managemen
668,"Limited opportunity for growth, communication is not always great","Great colleagues, salary, benefits"
669,late salary coming in,Good company and good people
670,- Can be organizationally disorganized due to rapid growth\r\n- Job posting and actual job responsibilities are not always aligned,"- Great work environment, young coworkers, cool office\r\n- Flexible work hours\r\n- Opportunities to learn new skills"
671,- Currently turning into a classic corporate with all its pros and cons\r\n- Very American in its ways of working and doing business,- Driven and ambitious employees\r\n- Perks\r\n- Fast pace and growth opportunities
672,Too much red tape now and days,"Worked at Google, Facebook, G&amp;E as a contingent and hated it. I worked as a contingent for uber as well, But they seen my value and converted me as FTE! I appreciate they took the time and effort to realize my value"
673,Uber is very inconsistent with promoting and job requirements. There is also no age diversity. We see partners of all age but the average age of management is under 30. They have no clue how to manage employees because there is not enough overall life experience.,Great benefits and a laid back environment.
674,"The public and media perception of the company is disappointing but to be expected. I've seen nothing but positive signs since joining and fully 100% stand behind the senior management, and the strength of our new culture. You can tell management has taken on the task of fixing Uber's past problems very seriously.","Great compensations and benefits. I get to work with the smartest people I have met, we share a vision, common values and objectives. Everybody is willing to teach me and help me out. Excellent work/life balance."
675,Everything. The management and the owner all need to be replaced,I can't think of anything positive to say about this place
676,"-constant reorgs that always will leave you on the short end of the stick (recent reorg resulted in a title change (no change in role or responsibility), find out at performance review that my overall compensation was cut due to the title change...brought up to management and HR with no action)\r\n-high dissatisfaction among employees towards management and the org\r\n-management does not care about your thoughts or opinions\r\n-management does not listen to your concerns \r\n-constant process changes, managerial changes, reorgs... (ie before dust settles from previous reorg...a new reorg is in happening)\r\n-limited internal mobility\r\n-no 401k matching, no tuition reimbursement\r\n-lower overall compensation with more duties and responsibilities as compared to competitors",-work with tremendous people who are very knowledgeable and eager to help you in any aspect \r\n-people encourage and motivate each other to bring out the best in you\r\n-great health benefits
677,You will work hard and at times long hours but you always feel like the work is making a difference.,"Great benefits, surrounded by intelligent people, ability to have input on the future of the company at any level, cutting edge, innovative, and fun!"
678,"Things changes so fast, that is difficult to stay in status quo evolution is a requirement","At Uber you have an opportunity to design how the future will look like, as well as changing cities dynamics and helping to create job opportunities.  It's a starup feeling in a big company"
679,- as the business in growing some changes come and go \r\n- management is learning on the move\r\n-,- Great responsibilities at all company levels encouraging accountability in all the org.\r\n- super learnings from all the areas based on execution\r\n- good mobility oportunities
680,Management level is not looking for big growth\r\nManagers are little bit biased,The pay is better than average\r\nThe environment is perfect\r\nThe team is young and energictic
681,Poor management and poor communication in between HQ and regional leaders.,Fast path and challenging environment
682,"The only con for me is the perception of the company in light of all the news articles that may paint Uber in a bad light.  Our new CEO, Dara, has implemented many positive changes and under this leadership we will continue to grow, improve, and thrive!","Uber offers ahmaaaaazing benefits to employees.  On top of that, my work is personally fulfilling.  I am given autonomy and creative authority over my work.  I enjoy the culture here that celebrates differences and encourages you to shine by sharing ideas even if they start off utterly ridiculous or seem out of reach.  I work alongside some of the most brilliant people you'll ever meet.  What a treat!  I have a voice here and the best part about it is that my voice is heard!"
683,"On the con side of the tech debt problem I alluded to before, there are parts of the engineering process that are painful at times.  We've been committing resources to fix it, but there's still a lot of room to improve.\r\n\r\nDifferent parts of the organization still feel oceans apart.  Maps reminds me a lot of Google, other parts of the company feel like other organizations entirely.  We still have a ways to go towards homogenizing our values and standards, but things are improving.  Just be mindful of which team you end up on if you decide to join.  that said, transferring is easy and encouraged.\r\n\r\nThe media attention can be draining.  The world can't seem to stop talking about Uber.  In some ways it feels motivating to be working when all eyes are pointed your way, but it can also be painful to be put under such intense scrutiny.","I've worked for a number of great companies over the years: Google, the games industry, research labs.  I can with confidence that Uber is the best place I've ever worked.\r\n\r\nThe challenges are fascinating.  We're not just building a website or driving ad clicks.  We're attempting to fundamentally change the way people and things are transported around the globe.\r\n\r\nThe impact is tangible.  At a place like Google, it's easy for an engineer to feel lost in the weeds.  Uber has become a big company, but every project still feels vital.  Every engineer has the chance to affect millions of riders and driver partners.\r\n\r\nThe opportunities are abundant.  Uber has grown faster than any startup in history, but that growth meant there wasn't always time to build to scale.  That's both a positive and a negative at times, but on the plus side, it means there are many parts of our tech stack that can be optimized and improved by a motivated engineer.  If you want to take ownership or a project you feel passionate about, no one is going to get in your way.\r\n\r\nChange is happening.  2017 was a real wake up call for Uber.  Thankfully, the company took note and listened.  We're now refocusing on the longterm sustainability of growth and talent.  I've seen so much positive change happen in just over a year.  It's been a roller coaster of emotions at times, but it always trends upwards."
684,Management still not transparent. No manager training being performed. HR function too weak. More effort needed for employees to feel valued.,Company has been making a lot effort in terms of employee management. Salary and Benefits have been improved over the last 1year
685,"stagnant, low pay, boring and repetitive.","Free snacks, über credits, lax"
686,Put more effective to company,l love the company
687,"Terrible pay, progression opportunities are limited by favouritism and/or Global policies","Intelligent peers, good social culture, friendly office, no severe hierarchy present"
688,Lack of defined paths to advancement,Catered lunches. Management is accessible.
689,"There could be more work/balance and sometimes we change the strategy too fast, so it is necessary a lot of flexibility from the employees to adapt.","Imagine yourself working surrounded by high level professionals, where anyone can give and idea and change things on a short period.\r\nWe do work a lot, but it is a really nice job!"
690,"- Not the company fault  but some employees haven't understood that this is still a company and they abuse it like IBM or something\r\n- They are evolving, which is not wrong but just painful to people who don't like change.","- Super Busy, Super Productive, Super Motivating\r\n- You can actually change life of people not just add a filter to a selfie.\r\n- Proud of working for a company with big bold bets"
691,"Most employees are much more competitive than collaborative (at least in Brazil, where I work)\r\nMost leaders are still white males\r\nPeople outside the company don't see it as cool as it really is","Good energy and ambiance;\r\nFocus on results, not methods;\r\nTrue push for \"
692,Not to much support and payment is done through a third party,Team oriented fun environment  relax work place
693,Don't really agree with Uber Eats and how much waste the business produced,"Smart people, fast paced environment"
694,"Career progression,  no clear structure","Free food, free transpo, apple computer"
695,11 hour shifts are tough,"Free food, great career progression opportunities and positive office environment."
696,Demanding tasks and learning on the job.,Challenging and Supporting culture that makes you excel in your professional careers. Many benefits and easy to switch among different roles
697,Culture is geared towards drinking and there is so much tension between the sexes. News articles you read are true--it's a frat boy playground where white guys in hoodies rule. Women have less opportunity to advance because they are often told that they are \,"Good health benefits, free lunches, great name to have on your resume, and a casual dress code."
698,Too many politics and bad compensation,Superpumped and opportunity to set up a system from scratch
699,"-It's a big company, so some of the same slow downs of working between teams happens, but it's not as bad as other bigger ones.\r\n-The food isn't as good as competitors, the management doesn't think this is serious but a lot of people care about what they put in their body every day (nutrition and quality)\r\n-The program/platform breakdown can cause issues where some program teams don't allocate time for tech debt and engineering excellence.\r\n-The alignment between product/design/eng could be much better (work in progress)\r\n-No dedicated on-call program where the volunteers make extra $ and not everyone has to contribute. This is what the other big players do and is a more mature way of operating.",-Really strong engineering practices and opportunities to learn\r\n-Brilliant and friendly people\r\n-Real world impactful work\r\n-The company has a real drive to change for the better culturally\r\n-A lot of opportunities for autonomy and personal initiatives\r\n-Faster moving than other big companies.
700,"The training process is not where it should be and nearly everyone seems to have a bumpy ride on their way to getting the hang of things, which can be daunting. Also, because you are often the third point of contact for Drivers...many people need to be shown a lot of empathy and understanding, along with being told \",Meeting people from all over the world and helping them is an amazing opportunity. Being the only point of contact that is in-person often means you are also the \
