,cons,pros
1646,Long Hours and growth prospect maybe limited unless have value adding abilities.,"Great Experience, Business wise you will be able to learn things like marketing strategy, advertising tactics, customer service knowledge and etc..."
1647,"As we grow at our crazy rate, we encounter problems. It is up to us to step up and fix those problems.","If I didn't work here and I knew what kind of work was going on at Uber, I would be pretty sad.\r\nThere is a ton of opportunity. There is a lot to learn. There is a lot to build. There is a lot to celebrate. I really can't think of another place I'd like to be."
1648,Bro culture to the max. People are hyper aggressive and basically encouraged to be confrontational with each other.,Super smart coworkers and a good product that people actually use. The work itself can be very exciting.
1649,- projects are often underscoped\r\n- we're hiring/growing so fast that there are new faces in the office all the time (makes it hard to recognize people)\r\n- negative perception of Uber brand on the outside makes it hard to get recognition for all the good things Uber does as a company :(,"When I walk around the office, I often think to myself: \"
1650,High expectations of the team from everyone\r\nSolid working hours with weekends common,"No matter what your experience you will be constantly challenged at Uber. \r\nYou'll be part of a young, vibrant and passionate team working in a pure start-up culture\r\nIf you have an idea that will help the company, your only limitation is your own drive.\r\nYou'll be exposed to a breadth of experiences you never thought possible. \r\nMonday's are never a drag since you know that each and every day you'll be learning things. \r\nUber credits - travel in style and share with your mates\r\nGym and Phone compensation"
1651,"Uber faces stiff competition in Asia. The company moves extremely face to get ahead, which means the work is more challenging than at your typical Silicon Valley tech company.","- A lot of startups claim to be changing the world. Uber actually helps people in 300+ cities earn an income and get around. It doesn't get higher impact than that.\r\n- Great engineering. Uber is pushing the boundaries of what dynamically typed, interpreted languages can do. It also picked up Node and Go when they were still very new and is now a leader in both.\r\n- Many problems the company faces can only be solved by a combination of technology and people. For example, how can we help concert-goers get to and from Coachella? The solution involved both product and operations teams. Even as an engineer I'm learning a lot about business just by following what our city teams and leadership do."
1652,"Salary was not satisfying, no future plans.","Nice atmosphere, Great opportunity for career kick-off."
1653,"Commute to SF is my only concern right now. Sometimes, work/life balance is a problem.","Company is in hyper growth. So, it's always busy. Management is helpful. Co-workers are nice."
1654,"The company is growing so rapidly that often we face situations or opportunities for which there is no plan. You need to be comfortable with ambiguity and not being afraid to just step up and fill the void. Most start-up & entrepreneurial folks love this, but others find it a con.","Fast-moving ownership culture -- you build what you want, launch it out, iterate quickly, make an impact. I previously worked at Google, which is a fantastic place, but it moves so slowly due to it being a permission culture (where everything needs approval).  At Uber, I'm free to make decisions and own the outcome, which means we can move really quickly. I feel young again!"
1655,There is so much to be done that I have not found an optimal work life balance yet.,"It is so refreshing to work for a company where everyone is so passionate.  Each employee is fighting to make Uber a better place everyday so that together we can make the world a better place.  Together we are creating the processes and the change. Other pros: culture, benefits, opportunity"
1656,"As I mentioned, long hours, but good hours. Growth means having to make rapid moves to a new desk or team.","You own the projects you take on. Said projects affect the real world. Crazy fun culture. Long hours, but good hours. Paid opportunities to learn new skills."
1657,"Will be expected to work hard, but everyone is in control of their time - no face time culture. You will most likely go to bed and wake up thinking about Uber.\r\n\r\nFast past is not for everyone.","Uber is growing incredibly quickly and radically changing the way people move around cities. This is made possible by an awesome team. How many opportunities to you get to completely shake up an industry?!\r\n\r\nDream job if you want to be surrounded by incredibly talented people and you thrive on ownership and autonomy. Every 3-6 months feels like a new role.\r\n\r\nCulture of innovation, best idea wins and helping each other no matter where in the world that person sits"
1658,You need to work hard and smart to achieve great outcomes. Uber is just like any other.,"The opportunity to succeed is yours. You are given amazing tools and the chance to make a real impact on a growing business. So it is really up to you.\r\n\r\nThe culture and the people are beyond impressive. I am impressed each day. Astronauts, Olympians, Facebook, Twitter, Google, Goldman Sachs, you name it and there is someone at Uber who has been there and came here wanting more.\r\n\r\nThe feedback mechanisms are comprehensive and there to enable ongoing success."
1659,"Distance from HQ can sometimes be a strain\r\nSome challenges around bad press, but proud to have an awesome Legal and Comms team who are always on top of it","Super energised team, agile and inventive approach to challenges \r\nIncredible growth potential\r\nGreat office culture\r\nThe team works hard and celebrates milestones\r\nAwesome perks!\r\nSeeing real impact on the world"
1660,Hours can be long but they go very fast! There aren't enough of them in the day.,"I get to problem solve every day with a super smart, driven team. We're empowered to make decisions, execute and share learnings. We're improving the cities that Uber operates in - it's exciting to come to work every single day!"
1661,None. Nothing. 0. Zero. It is a great place to work and I don't have a bad thing to say about it.,"If you want to learn at the fastest growing company ever, uber is the only option. Amazing talent and the ability to move fast."
1662,"No cons, I love this company.","Could not be happier! I left a big-company, corporate environment to come to Uber, and it has been life changing. The level of ownership and responsibility given to you from Day 1 is unparalleled. I actually want to come to work, and sometimes work feels like that good book that you just can't put down at the end of the night.\r\n\r\nThe team is young, smart, dynamic, and has your back. Not once have I seen an instance of someone trying to take credit for someone else's work or acting shady in anyway, something that was rampant at my previous company.\r\n\r\nBeing part of something like Uber is electrifying and addicting.\r\n\r\nMeals at work, amazing perks and benefits (health, 401k, equity, etc)."
1663,work a lot of hours,get to meet new people
1664,"1) Fast, intense pace is not for everyone\r\n2) Must be able to handle ambiguity and independence well",1) Tons of upside\r\n2) Many opportunities for career growth\r\n3) Results-oriented culture\r\n4) Passionate co-workers
1665,"- Hours are very long and difficult, but the challenge is greatly appreciated by highly-driven and motivated individuals. Having come from other start-ups that were moving a break-neck speed (relatively speaking), the speed at Uber blows them all away.","- Extremely fast paced and exciting environment.\r\n- The people are hands-down amazing, super intelligent, creative, and diverse.\r\n- The culture is extremely special (representative of the people who work here).\r\n- Constantly changing the world with limitless future potential."
1666,"Constant change and the overseas workers are very bad at their jobs so your job is basically just cleaning up their mess. They are phasing out all the work from home workers in the US so they can take over, too. You never know when someone is going to disappear and nobody will tell you what's going on. No heads up whatsoever about your contract being extended. I've met with my manager twice in 6 months. No values.",The pay is nice and working from home is great. Hands off management is cool too I suppose.
1667,boring at times otherwise good job,works around your schedule \r\neasy money
1668,- Bring your A game everyday because you will be challenged and questioned frequently \r\n- Lots of people equals highly competitive culture,"- Unlimited Vacation Policy\r\n- Equity options are available \r\n- Learn quickly and build a large network \r\n- Work directly with the community you are seeking to serve\r\n- Gain feedback and metrics reports on the performance of your products  \r\n- Autonomy is encouraged to help you build, create and test new solutions\r\n- Rapid design and implementation process, helps your designs get to market quickly   \r\n- Positively improve the lives of millions of people around the globe with your designs"
1669,It will be great if UBER can make all the efforts possible to start an employee match on their 401K plan.,"Great environment, lots of perks and room for growth."
1670,"To be honest, the only thing that is at times frustrating is that at the rate at which we're growing, we all have to spend a lot of time onboarding new employees and getting them up to speed on our projects and processes. This is a good problem to have though :)","As a software engineer at Uber, I get to work on products that ship to millions of users and improve their lives in a very tangible way. We are constantly innovating, designing new products and features, and shipping them fast. Our roadmap is heavily data-driven, and we use the information we collect to make informed decisions about what works and what doesn't. Engineers at Uber have a lot of say in how products are architected and designed, and communication across the entire organization is very open. People are extremely intelligent, kind, and supportive of one another. I'd recommend working here to any talented software engineers, PMs, or designers. Now is the time to join!"
1671,"weekly video meetings, boring, micro management much?","Flexible hours, remote work, pay"
1672,"Expectations not verbalized at any point, no manager reviews","Amazingly flexible schedules, great pay"
1673,Growing fast comes w/ growing pains. Technical debt and some long nights.,Incredible growth leads to really interesting scaling challenges\r\nMost ambitious place I've ever worked. Fantastic long term vision. \r\nSmart passionate coworkers
1674,"- If you don't live in SF, your commute will suck.","- Very sharp engineers, driven to succeed.\r\n- Lots of engineers from other top tech companies like Facebook, Google, Apple, Amazon, etc. This gives us the ability to replicate what makes sense, and leave behind what doesn't. It's a fresh start.\r\n- The overall mission of the company makes total sense.\r\n- Being a part of an epic disruption story is exciting.\r\n- Revenues are astronomic, in uncharted territory for a start-up / private company. This makes 2015 an extremely good time to join.\r\n- I work as hard as any other Silicon Valley engineer. We work hard, but not too hard, and there is work/life balance."
1675,Work/life balance needs improve. Some managers have no vision what the team should do.,Engineering team moves very fast;\r\nThe product is very exiting;\r\nEngineers there have chance to work on from frontend to backend.
1676,"They treat their employees like they treat their drivers: subservient. I've never interviewed somewhere where I actually felt like the interviewers were against me. I should have taken that as a red flag, but I joined anyways and quit a month later.","The reason I was attracted was its startup market. Each region has relative autonomy, so there's a good degree of breathing space. I also liked the company's overall vision."
1677,"Start up, lots of uncertainty and instability","The people, the pace, tech is fun"
1678,- no room to move up,-work from anywhere\r\n-great manager\r\n-great communication\r\n-flexible hours
1679,"This is not for people who are looking for a comfortable and stable job and want to get by. You will have to work hard, be smart and work long. It might take a hit on your work-life balance.",Uber has some of the smartest people in the valley. Everyone across the company in all the units works incredibly hard and doing extra-ordinary things. Everyone is on a mission!
1680,"Managers are incompetent and can't guide, advise, or control their employees. You'll be asked to make decisions you aren't qualified to make.... unless you're getting backlash for demonstrating too much independent thought and initiative. Competent people are encouraged to leave if they don't match an arbitrary and unspoken standard (which will be framed as having \","Really interesting work, impacting millions of users globally. Very cool to be part of something so big. You get free ride credits, which is really nice."
1681,"A lot of responsibility, high accountability, and relentless expectation to execute.","Amazing company, highly recommended for everyone and anyone that loves building/creating their own business."
1682,there's a lot of work to do!,company is growing at an incredible rate\r\nsolve challenging problems\r\npeers/leads are very supportive
1683,"We work extremely hard (because we love it), so be prepared to give up some work-life balance.","Sheryl Sandberg once said: 'If you're offered a seat on a rocket ship, don't ask what seat! Just get on.' Uber is a rocketship. I learned more in my first 3 months at Uber than I did in my 7 years in previous jobs. The calibre of people here is unbelievable. We are all on a mission to change the world. Right now, we are connecting riders to drivers - who knows what we will be doing in 5 years from now! Trust me - you want to be a part of this story."
1684,Too many meetings interfere with your work schedule. Special projects are added in addition to your current workload.,"They cater your lunch, but it's only so they can keep you in the building working to compensate for the ineffective business practices."
1685,No cons I have zero complaints. This is the first time in my life where I look forward to coming to work.,"Culture, exciting stuff to work on and we are changing the world for the better!"
1686,Always changing. No real hope of becoming full-time.,Working remotely. No micro-management. Supervisors are pretty nice folks.
1687,"The fast pace makes the work more interesting, but also means your managers will have less time for you.",Loved working here and was always happy to get to the office.  Constantly learning new things.
1688,"* Fast-paced work environment - if that isn't what you're after, this isn't your spot.",* Extremely gifted engineers all around\r\n* Freedom to get things done that you think are important\r\n* Massive influence possible as an individual contributor
1689,None.\r\n\r\nAt Uber we haven't done the best job communicating the facts about our company.,Best talent I've ever worked with\r\nEmployees are empowered to do the most impactful things and solve problems creatively\r\nAll work is high impact and high priority\r\n100% aligned with management and company direction
1690,can be tough sometimes,"working with people,a way to socialize"
1691,"Sometimes there is a sense of being in a bubble, with folks working late night and not having a good work-life balance, creating a competitive environment that can be a bit overwhelming.","After working for Uber for a couple of months now, I see that staggering difference between what Uber is perceived as and what it actually is. Filled with young, smart folks that want to see this amazing product be accessible to more and more people, it feels like folks on on a mission."
1692,"If working longer hours is not of interest to you, this might not be the best option. Also, there is an emphasis on autonomy here, which is not for everyone.","From day one, I felt genuinely welcomed by all of my coworkers. The Uber family is one you definitely want to be a part of, and I could not be happier here. Everyone here works their tails off, they're motivated to succeed, having bought into the idea of Uber as a whole. Best of all, the team is here to help -- whether it be on a rider or driver initiative, an issue running data analysis, creating rider and driver communications, and so on. Working on a remote team has been an incredible experience and given me the opportunity to hone in on my entrepreneurial spirit while improving the cities we run. It's a rewarding career/company and one I hope to be a part of for years to come."
1693,"@ $40B, how much can you options really grow? It probably is great for the first group of employees, but I cannot imagine a new employee becoming an options millionaire.","Amazingly fast growing company, with more room to grow. Attracts good people and has locations across the globe. Startup mentality at the regional offices, with big company (hopefully) resources."
1694,Contract position.  But normally the top tier workers get contract renewals,"Great pay for a Work at Home position, Good Training, Helpful staff"
1695,Growing so fast it's hard to keep up \r\nYou will work long hours,Start up culture\r\nOpen autonomy \r\nEntrepreneurial approach\r\nLots of flexibility in how you achieve your goals\r\nSurrounded by highly capable and bright individuals \r\nThe grind- there's so much to be done and so many opportunities to make an impact\r\nMY TEAM!!! They kick serious booty.
1696,"The company as it stands today is a pre-IPO slaughterhouse. Depending on what team you're on, or the luck of the draw, you will be guilted into working crazy hours. After all, everyone else does it, so why shouldn't you? You will be on-call 24 hours a day. You will be judged heavily by your \","Uber is jam packed with amazing talent. So many hard engineering problems, product problems, and finance problems. It's easy to learn a ton, and it's awesome to be a part of such an interesting company. I can say that I've met many fun, incredible people there, and I do believe Uber is making a tangible change in the world."
1697,I can't think of any!,"Brilliant people, fast pace, changing the world"
1698,"The company is growing extremely fast; sometimes there are more people than desks and working arrangements can get very... 'cozy'. With that growth comes lots of change, and you will feel very uncomfortable if you are used to being in a predictable environment.\r\n\r\nWork/life balance may be a deal breaker for some. We're trying to grow the team as fast as the number of problems we're facing is growing, but sometimes the latter outpaces the former and the days can get very long, but the work is usually still exiting. I've never been told to work on a weekend, but I have voluntarily spent a few at the office building something I wanted to make.","Startups love to talk about how they're 'killing it', even though usually they're just struggling to survive to their next round of funding.  The focus on Uber isn't on 'killing it', everyone knows we're already doing that; we want to know what we can do to kill it faster.\r\n\r\nCompensation is extremely competitive, and includes something that no other company can offer: equity in one of the fastest growing companies in history.  Even now, Uber is out of its infancy and continuing to double revenues every six months.\r\n\r\nTransparency within the company is a big part of our culture. There's a weekly meeting where anyone in the company can ask the CEO a question and get an honest/unfiltered response.\r\n\r\nYou get to work with a lot of extremely talented people from a wide variety of backgrounds.  I've met people at HQ from six different continents, and I'm currently the only male engineer on my team. Diversity is a common buzzword these days, but at a company as small and simultaneously global as Uber it's also a reality."
1699,"Uber moves fast and we have to because we live and work in an ever changing world of regulation, culture, supply, demand, and on and on.\r\n\r\nWorking at Uber isn't for everyone.  Everyone at Uber is dedicated to the company and each person does what it takes to make Uber a success.\r\n\r\nDoes that mean you work till midnight every night or the weekends?  Sometimes.  Is that a weekly thing? No, it's rare but it will happen.\r\n\r\nDoes that mean you'll get woken up at 3AM to take care of a critical issue that's happening during the day across the world? Sometimes.  Is that a daily thing? No, it's rare but it will happen.\r\n\r\nBut to me, none of it matters because Uber is a company, product, and vision that I care about and am dedicated to.","I like to say working at Uber is great because of the four Ps. \r\n\r\nP - Product\r\nP - People\r\nP - Process\r\nP - Problems\r\n\r\nProduct:\r\nOur product is something that I use every single day.  I've worked at various companies in both the B2B and B2C sector and I've never cared about a product as much as I do Uber. Getting around a city (both where I live and where I travel) was always a pain before Uber.  Now when I leave my house I don't have to worry about how I'm going to get there because the answer is Uber.\r\n\r\nPeople:\r\nThe people that I work with are amazing.  They come from all walks of life and each person has a different background . People here have individually accomplished so much and have worked so many places in their past that there is always something to learn.  Scaling AWS at Amazon, building the infrastructure of Yelp, and building Amazon's product in the early days are just a few of the amazing accomplishments that my co-workers have achieved.\r\n\r\nProcess:\r\nGet stuff done and Uber will provide you the tools and resources to do that.  \r\n\r\nNeed a vacation? Take one.\r\nNeed a light at your desk? Here's one.\r\nWant to work across the country at one of our offices? Go. \r\nWant to work from home in the mornings? Do it.  \r\n\r\nWhat matters is that you get stuff done."
1700,"Lots of ambiguity, little formal training, very long hours, though I've never had days go by quicker.",Competitive salary and great benefits. Awesome work and the amount of autonomy offered by no other company. Just about everything you do is high impact. You really do make an impact every day.
1701,"The growth. It's a lot to work with and it's constantly changing everyday, making it somewhat inefficient on my end at times. Communication could be better as I am left out from important updates that are critical for me to perform my job as a contractor.",I like the enthusiasm that everyone has and how we all work and play hard. It's a cool place to work and come to each day. It's never a dull day!
1702,"- Compensation (unless you're an engineer). 12hr+ work days, yet still a constant worry about paying those SF monthly bills. I've been here about a year now and have noticed most people seem to be working here to either a) satisfy their want to make a huge impact and escape corporate America, or b) to push through the low salary in order to get to the IPO.\r\n- Lack of leadership. Uber's a great company because we hire entrepreneurs. Put a bunch of all stars on one team, there will be conflict and egos. In my opinion, it's a blessing and a curse. You certainly want all stars because those people will do great things, but you also want really solid coaches to help you learn how to bring out your full potential and to teach you how to bring out the full potential of those around you.","+ The people. Passionate, open-minded, ambitious, supportive.\r\n+ Startup at it's finest. Over 1400 people, but feels like &lt; 100.\r\n+ Endless opportunities. Anyone, no matter the role, can build something great and get noticed.\r\n+ Culture. Overall amazing place to work with very limited almost nonexistent micro managing. \r\n+ \"
1703,"There are times where you'll be given hard deadlines, simply due to regulatory demands and business contracts with partners. This can make some weeks more stressful than others.","Uber is a technology-first company. Despite its number of users growing exponentially month over month, the mobile product remains highly scalable and stable, unlike any other fast growing company that I have worked for.\r\n\r\nProduct teams, engineers, and designers collectively decide which features are the most important for upcoming sprints and, so during development, all hands are on deck and everyone involved is excited to build the feature."
1704,"You have to look out for yourself to make sure you have the support you need to do your job right. Self-starters do best. Very little hand holding. Fewer perks than other tech companies. Very demanding, of course.","Fast paced, tons of opportunities to contribute, great positive atmosphere, very sharp coworkers. Lots of very interesting and far reaching problems being worked on. Attracts passionate people who are the best at what they do."
